{
  "$schema": "contracts/host-deltas.schema.json",
  "entries": [
    {
      "category": "runtime",
      "desired_state": "Hermes Agent 0.21.5 installed",
      "enablement": "installed",
      "host": "hermes",
      "id": "hermes-runtime",
      "owner": "host-runtime",
      "prerequisites": [
        "operator installs the declared runtime"
      ],
      "readback": {
        "argv": [
          "hermes",
          "--version"
        ],
        "contains": "0.21.5",
        "kind": "command"
      },
      "redaction": "metadata-only",
      "required": true,
      "restore": {
        "kind": "prerequisite",
        "reference": "install the declared Hermes runtime"
      },
      "source_identity": "prerequisite:install the declared Hermes runtime",
      "version_or_hash": "version:0.21.5"
    },
    {
      "category": "runtime",
      "desired_state": "Codex CLI 0.158.0-alpha.2.1 installed",
      "enablement": "installed",
      "host": "codex",
      "id": "codex-runtime",
      "owner": "host-runtime",
      "prerequisites": [
        "operator installs the declared runtime"
      ],
      "readback": {
        "argv": [
          "codex",
          "--version"
        ],
        "contains": "0.158.0-alpha.2.1",
        "kind": "command"
      },
      "redaction": "metadata-only",
      "required": true,
      "restore": {
        "kind": "prerequisite",
        "reference": "install the declared Codex runtime"
      },
      "source_identity": "prerequisite:install the declared Codex runtime",
      "version_or_hash": "version:0.158.0-alpha.2.1"
    },
    {
      "category": "runtime",
      "desired_state": "OMP 18.2.6 installed",
      "enablement": "installed",
      "host": "omp",
      "id": "omp-runtime",
      "owner": "host-runtime",
      "prerequisites": [
        "operator installs the declared runtime"
      ],
      "readback": {
        "argv": [
          "omp",
          "--version"
        ],
        "contains": "18.2.6",
        "kind": "command"
      },
      "redaction": "metadata-only",
      "required": true,
      "restore": {
        "kind": "prerequisite",
        "reference": "install the declared OMP runtime"
      },
      "source_identity": "prerequisite:install the declared OMP runtime",
      "version_or_hash": "version:18.2.6"
    },
    {
      "category": "settings",
      "desired_state": "allowlisted declarative settings match the recovery snapshot",
      "enablement": "managed",
      "host": "hermes",
      "id": "hermes-settings",
      "owner": "recovery:hermes:settings",
      "prerequisites": [
        "hermes runtime 0.21.1 is installed"
      ],
      "readback": {
        "kind": "recovery-artifact",
        "reference": "hermes:settings"
      },
      "redaction": "public-artifact",
      "required": true,
      "restore": {
        "kind": "recovery-artifact",
        "reference": "hermes:settings"
      },
      "source_identity": "recovery-artifact:hermes:settings",
      "version_or_hash": "sha256:8e6d0c6c0cbd02e1f838b8e96d580ae84ca1758076cd65fa9c6661103d34f297"
    },
    {
      "category": "settings",
      "desired_state": "allowlisted declarative settings and plugin selections match the recovery snapshot",
      "enablement": "managed",
      "host": "codex",
      "id": "codex-settings",
      "owner": "recovery:codex:settings",
      "prerequisites": [
        "codex runtime 0.153.1 is installed"
      ],
      "readback": {
        "kind": "recovery-artifact",
        "reference": "codex:settings"
      },
      "redaction": "public-artifact",
      "required": true,
      "restore": {
        "kind": "recovery-artifact",
        "reference": "codex:settings"
      },
      "source_identity": "recovery-artifact:codex:settings",
      "version_or_hash": "sha256:7c13a6eac82281bfe08b836d4bc118af93595e25dc1c65bd545e4e660f9e6712"
    },
    {
      "category": "settings",
      "desired_state": "allowlisted declarative settings match the recovery snapshot",
      "enablement": "managed",
      "host": "omp",
      "id": "omp-settings",
      "owner": "recovery:omp:settings",
      "prerequisites": [
        "omp runtime 17.2.13 is installed"
      ],
      "readback": {
        "kind": "recovery-artifact",
        "reference": "omp:settings"
      },
      "redaction": "public-artifact",
      "required": true,
      "restore": {
        "kind": "recovery-artifact",
        "reference": "omp:settings"
      },
      "source_identity": "recovery-artifact:omp:settings",
      "version_or_hash": "sha256:bb8e76ee1784d6ae2639c6ec6f43e41d82bc50e7b4c4ccb5eff22345f5f87543"
    },
    {
      "category": "instructions",
      "desired_state": "Hermes user-global overlay includes the canonical Agent Sync reconciliation route",
      "enablement": "enabled",
      "host": "hermes",
      "id": "hermes-instructions",
      "owner": "recovery:hermes:standing-instructions",
      "prerequisites": [
        "hermes runtime 0.21.1 is installed"
      ],
      "readback": {
        "kind": "recovery-artifact",
        "reference": "hermes:standing-instructions"
      },
      "redaction": "public-artifact",
      "required": true,
      "restore": {
        "kind": "recovery-artifact",
        "reference": "hermes:standing-instructions"
      },
      "source_identity": "recovery-artifact:hermes:standing-instructions",
      "version_or_hash": "sha256:f2c2fce51ec2de50fbdec54f29d677c3719b74849e1411ed111c8bf6e02166d9"
    },
    {
      "category": "instructions",
      "desired_state": "Codex user-global overlay includes the canonical Agent Sync reconciliation route",
      "enablement": "enabled",
      "host": "codex",
      "id": "codex-instructions",
      "owner": "recovery:codex:global-instructions",
      "prerequisites": [
        "codex runtime 0.153.1 is installed"
      ],
      "readback": {
        "kind": "recovery-artifact",
        "reference": "codex:global-instructions"
      },
      "redaction": "public-artifact",
      "required": true,
      "restore": {
        "kind": "recovery-artifact",
        "reference": "codex:global-instructions"
      },
      "source_identity": "recovery-artifact:codex:global-instructions",
      "version_or_hash": "sha256:dfdc91e9e488e3f70564fccf34925d741aa1469d4bbd9617b14c33755819d002"
    },
    {
      "category": "instructions",
      "desired_state": "OMP's opt-out Codex discovery provider remains disabled",
      "enablement": "absent",
      "host": "omp",
      "id": "omp-instructions",
      "owner": "OMP 18.1.10 native discovery configuration",
      "prerequisites": [
        "omp runtime 18.1.10 is installed"
      ],
      "readback": {
        "argv": [
          "omp",
          "config",
          "get",
          "enabledProviders",
          "--json"
        ],
        "kind": "command",
        "not_contains": "codex"
      },
      "redaction": "metadata-only",
      "required": true,
      "restore": {
        "kind": "runtime-managed",
        "reference": "OMP native discovery provider state"
      },
      "source_identity": "runtime-managed:OMP native discovery provider state",
      "version_or_hash": "runtime-version:18.1.10"
    },
    {
      "category": "hook",
      "desired_state": "No configured shell hooks; inspect the selected config without CLI startup writes.",
      "enablement": "absent",
      "host": "hermes",
      "id": "hermes-hook-state",
      "owner": "host-runtime",
      "prerequisites": [
        "hermes runtime 0.21.1 is installed"
      ],
      "readback": {
        "format": "yaml",
        "key": "hooks",
        "kind": "config-empty",
        "path": "config.yaml"
      },
      "redaction": "metadata-only",
      "required": true,
      "restore": {
        "kind": "runtime-managed",
        "reference": "Hermes native shell-hook state"
      },
      "source_identity": "runtime-managed:Hermes native shell-hook state",
      "version_or_hash": "runtime-version:0.21.0"
    },
    {
      "category": "hook",
      "desired_state": "the independent PreToolUse catastrophic-command guard remains captured; intentionally retired GSD session-start hooks stay absent",
      "enablement": "enabled",
      "host": "codex",
      "id": "codex-safety-hooks",
      "owner": "recovery:codex:settings",
      "prerequisites": [
        "codex runtime 0.153.1 is installed"
      ],
      "readback": {
        "kind": "recovery-artifact",
        "reference": "codex:settings"
      },
      "redaction": "public-artifact",
      "required": true,
      "restore": {
        "kind": "recovery-artifact",
        "reference": "codex:settings"
      },
      "source_identity": "recovery-artifact:codex:settings",
      "version_or_hash": "sha256:7c13a6eac82281bfe08b836d4bc118af93595e25dc1c65bd545e4e660f9e6712"
    },
    {
      "category": "hook",
      "desired_state": "the standalone agent-surface-governance authority is disabled and superseded by Agent Sync reconciliation",
      "enablement": "absent",
      "host": "codex",
      "id": "codex-legacy-governance-absent",
      "owner": "cross-agent-surface-engineering",
      "prerequisites": [
        "Agent Sync repository is present"
      ],
      "readback": {
        "argv": [
          "codex",
          "plugin",
          "list",
          "--json"
        ],
        "kind": "command",
        "not_contains": "agent-surface-governance@local-agent-skills"
      },
      "redaction": "metadata-only",
      "required": true,
      "restore": {
        "kind": "repository",
        "reference": "canonical Agent Sync reconciliation route"
      },
      "source_identity": "repository:tools/reconcile.py",
      "version_or_hash": "sha256:5a8e3df3795b9c930d2961dfa7cb95b11b719c53aa58722516607eae8e5580b2"
    },
    {
      "category": "hook",
      "desired_state": "explicit reconciliation routes through the shared Agent Sync workflow without a competing authority",
      "enablement": "absent",